{
  "version": "1.0",
  "handoff_id": "H-001",
  "revision": 0,
  "project": {
    "name": "new-project",
    "objective": "Coordinate parallel work without losing ownership, dependencies, or evidence."
  },
  "created_at": "2026-09-17T00:00:00Z",
  "updated_at": "2026-09-17T00:00:00Z",
  "coordination": {
    "content_plane": "data",
    "claim_policy": "single-owner-with-lease",
    "integration_policy": "explicit-review-before-merge"
  },
  "base_state": null,
  "agents": [],
  "work_items": [],
  "events": [
    {
      "id": "E-000001",
      "at": "2026-09-17T00:00:00Z",
      "type": "board_initialized",
      "actor": "system",
      "details": {}
    }
  ]
}
